{
  "schema_version": "1.0.0",
  "configuration_id": "cfg:invented",
  "corpus_id": "corpus:aaaaaaaaaaaaaaaaaaaaaaaaaaaaaaaaaaaaaaaaaaaaaaaaaaaaaaaaaaaaaaaa",
  "label_version": "invented-label-v1",
  "official": {
    "status": "official_D-085",
    "n_answerable": 1,
    "n_refusal_excluded": 0,
    "undefined_reason": null,
    "source": {
      "recall_at": {
        "1": 1.0,
        "3": 1.0,
        "5": 1.0,
        "10": 1.0
      },
      "mrr": 1.0
    },
    "passage": {
      "recall_at": {
        "1": 1.0,
        "3": 1.0,
        "5": 1.0,
        "10": 1.0
      },
      "mrr": 1.0,
      "comparability": "within_configuration_only",
      "n_undefined": 0
    }
  },
  "provisional": {
    "status": "proposed_provisional_not_official",
    "span_hit_recall_at": {
      "1": 1.0,
      "3": 1.0,
      "5": 1.0,
      "10": 1.0
    },
    "n_direct_spans": 1
  }
}
